class_id,focus_zone_1,focus_zone_2,focus_zone_3,action_plan_1,action_plan_2,action_plan_3
class_10,"Difficulty applying formulas or definitions in Physics and Chemistry, especially in multi-step problems involving kinematics, oxidation numbers, and unit conversions.","Struggles with harder-difficulty questions involving fractions, number series, and ratio comparisons.","Misunderstanding of fundamental definitions and relationships within Physics and Chemistry (e.g., isotopes, reducing agents, cellular transport).","Reinforce Incorporate worked examples in Physics and Chemistry lessons, emphasizing the step-by-step application of formulas and definitions. Model the thought process for selecting the correct formula based on the problem context.","Reinforce Dedicate class time to reviewing fraction and number series concepts, focusing on visual aids and manipulatives to reinforce understanding. Provide targeted practice on harder-difficulty problems.",Reinforce Implement short quizzes focusing specifically on definitions and relationships within Physics and Chemistry. Use these quizzes to identify areas where students are struggling and provide immediate clarification.
class_7,Consistent errors in SI unit conversions across varying difficulty levels.,Difficulties with applying definitions in both biological processes and properties of water.,Struggle with word problems and interpreting how formulas apply.,"Reinforce Dedicate a lesson to dimensional analysis and practical examples of SI unit conversions, emphasizing the setup of conversion factors.",Use concept mapping and collaborative definition-building activities to reinforce the application of scientific definitions.,"Reinforce Incorporate worked examples of word problems, explicitly modeling the process of identifying relevant information and selecting appropriate formulas."
class_9,"Consistent difficulty with medium-to-hard difficulty questions requiring multi-step reasoning, especially in physics and chemistry concepts like wave properties, pressure calculations, and application of formulas related to force and motion.","Recurring conceptual errors in applying definitions and relationships, as well as properties, indicating a struggle with abstract concepts across physics, chemistry, and biology.",Noticeable calculation errors and difficulties with formula application.,"Reinforce Incorporate more worked examples of multi-step problems in physics and chemistry, explicitly modeling the reasoning process and formula application.","Use concept mapping activities or other visual aids to help students explicitly connect definitions, relationships, and properties for key concepts in each unit.","Reinforce Implement regular ""error analysis"" exercises where students identify and correct mistakes in sample calculations or formula applications."
class_engineering,"Consistent errors in algebraic manipulation, including sign errors, coefficient errors, and misapplication of formulas, frequently derail problem-solving, even when initial setup is correct.","Difficulty translating word problems into correct algebraic equations, often compounded by subsequent calculation errors.","the class avoid attempting hard-difficulty questions, indicating a possible lack of confidence or familiarity with more complex problem types.","Reinforce Incorporate explicit practice of algebraic manipulation skills, focusing on error-prone areas like negative signs and distribution, using worked examples and immediate feedback.","Reinforce Devote class time to deconstructing word problems and modeling the process of translating them into algebraic equations, emphasizing careful reading and identification of key information.","Introduce strategies for approaching difficult problems, such as breaking them down into smaller steps or using simpler examples to illustrate the underlying concepts. Encourage a growth mindset by emphasizing effort and persistence over innate ability."
class_medical,"Difficulty applying Physics formulas related to work, energy, and motion (calculation errors, multi-step problems).","Inconsistent understanding of Periodic Table trends, especially ionization energy.","Some confusion regarding specific biological functions/definitions (e.g., blood clotting).","Reinforce Incorporate more worked examples of multi-step physics problems, emphasizing the breakdown of formulas and unit analysis.",Reinforce Dedicate a lesson to explicitly connecting periodic table trends (ionization energy) to observable chemical properties and reactions.,"Reinforce Review key biological definitions/functions (e.g., blood clotting cascade) using visual aids or concept mapping to reinforce understanding."
